{
  "$schema": "../schemas/language.schema.json",
  "id": "typescript",
  "name": "TypeScript",
  "enabled": true,
  "detect": {
    "command": "node",
    "arguments": ["--version"]
  },
  "build": {
    "workingDirectory": "{implementationDir}",
    "command": "node",
    "arguments": [
      "{projectRoot}/node_modules/typescript/bin/tsc",
      "--project",
      "tsconfig.json"
    ],
    "artifact": "dist/index.js"
  },
  "run": {
    "command": "node",
    "arguments": [
      "{artifact}",
      "--input",
      "{inputFile}",
      "--output",
      "{outputFile}"
    ]
  },
  "environment": {
    "NODE_ENV": "production"
  },
  "sourceExtensions": [".ts"]
}
