{
  "$schema": "../schemas/language.schema.json",
  "id": "go",
  "name": "Go",
  "enabled": true,
  "detect": {
    "command": "go",
    "arguments": ["version"]
  },
  "build": {
    "workingDirectory": "{implementationDir}",
    "command": "go",
    "arguments": [
      "build",
      "-ldflags=-s -w",
      "-o",
      "{artifact}",
      "."
    ],
    "artifact": ".arena/{benchmarkId}"
  },
  "run": {
    "command": "{artifact}",
    "arguments": [
      "--input",
      "{inputFile}",
      "--output",
      "{outputFile}",
      "--timing-output",
      "{timingOutputFile}",
      "--warmup",
      "{warmupIterations}",
      "--min-iterations",
      "{minMeasuredIterations}",
      "--max-iterations",
      "{maxMeasuredIterations}",
      "--target-relative-ci",
      "{targetRelativeConfidenceInterval}"
    ]
  },
  "environment": {},
  "sourceExtensions": [".go"]
}
